{
  "schema_version": "0.1.0",
  "artifact": "legacy_assessment_source_registration_proposals",
  "status": "NONCANONICAL_PROPOSAL",
  "derived_from": {
    "programme_checkpoint": "v2.2.0",
    "source_universe_count": 248,
    "assessment_evidence_count": 52,
    "deterministic_matched_evidence_count": 15,
    "unresolved_evidence_count": 37,
    "registration_eligible_evidence_count": 35,
    "exact_identity_source_proposal_count": 33,
    "missing_explicit_source_count": 1,
    "curation_required_count": 1,
    "fuzzy_matching": false
  },
  "authority_boundary": "Proposal data only. This artifact neither changes historical assessments nor publishes a canonical successor source universe.",
  "proposals": [
    {
      "proposal_id": "LEGACY-SRC-PROP-001",
      "action": "REGISTER_NEW_SOURCE",
      "review_state": "PROPOSED_NONCANONICAL",
      "identity_rule": "EXACT_NORMALIZED_URL_AND_CHECKSUM",
      "identity_rationale": "Evidence records are grouped only when an identical normalized public URL and/or normalized checksum establishes exact artifact identity.",
      "normalized_public_url": "https://facebookresearch.github.io/brain2qwerty/assets/brain2qwerty_v2.pdf",
      "checksum": "38669c93520bc6dccfd2bd13563a6ada733fc2ef78978a3678bc6ebde7ee9e67",
      "existing_source_id": null,
      "requested_source_id": null,
      "linked_evidence": [
        {
          "system": "Brain2Qwerty",
          "assessment_version": "v4.1.3",
          "evidence_id": "EV-01",
          "title": "Accurate Decoding of Natural Sentences from Non-Invasive Brain Recordings",
          "source_label": "Zhang et al.",
          "evidence_type": "PREPRINT",
          "evidence_class": null,
          "publication_state": "Public preprint dated 29 June 2026; under review"
        }
      ],
      "impacted_requirement_count": 72,
      "impacted_requirement_ids": ["NK-01-R01","NK-01-R02","NK-01-R03","NK-01-R04","NK-01-R05","NK-01-R06","NK-02-R01","NK-02-R02","NK-02-R03","NK-02-R04","NK-02-R05","NK-02-R06","NK-03-R01","NK-03-R02","NK-03-R03","NK-03-R04","NK-03-R05","NK-03-R06","NK-04-R01","NK-04-R02","NK-04-R03","NK-04-R04","NK-04-R05","NK-04-R06","NK-05-R01","NK-05-R02","NK-05-R03","NK-05-R04","NK-05-R05","NK-05-R06","NK-07-R01","NK-07-R02","NK-07-R03","NK-07-R04","NK-07-R05","NK-07-R06","NK-08-R01","NK-08-R02","NK-08-R03","NK-08-R04","NK-08-R05","NK-08-R06","NK-09-R01","NK-09-R02","NK-09-R03","NK-09-R04","NK-09-R05","NK-09-R06","NK-10-R01","NK-10-R02","NK-10-R03","NK-10-R04","NK-10-R05","NK-10-R06","NK-11-R01","NK-11-R02","NK-11-R03","NK-11-R04","NK-11-R05","NK-11-R06","NK-12-R01","NK-12-R02","NK-12-R03","NK-12-R04","NK-12-R05","NK-12-R06","NK-13-R01","NK-13-R02","NK-13-R03","NK-13-R04","NK-13-R05","NK-13-R06"],
      "source_boundary_note": "Registration records source identity only; it does not establish scientific validity, regulatory status, clinical benefit, deployment, commercial status, or conformance."
    },
    {
      "proposal_id": "LEGACY-SRC-PROP-002",
      "action": "REGISTER_NEW_SOURCE",
      "review_state": "PROPOSED_NONCANONICAL",
      "identity_rule": "EXACT_NORMALIZED_URL_AND_CHECKSUM",
      "identity_rationale": "Evidence records are grouped only when an identical normalized public URL and/or normalized checksum establishes exact artifact identity.",
      "normalized_public_url": "https://facebookresearch.github.io/brain2qwerty/",
      "checksum": "ef5ca7a9ac84856b1f53fa75f3775043c664aa86281683d1cf67bfc465c00b5a",
      "existing_source_id": null,
      "requested_source_id": null,
      "linked_evidence": [{"system":"Brain2Qwerty","assessment_version":"v4.1.3","evidence_id":"EV-02","title":"Brain2Qwerty official project page","source_label":"Meta FAIR","evidence_type":"OFFICIAL PROJECT PAGE","evidence_class":null,"publication_state":"Public official project page"}],
      "impacted_requirement_count": 72,
      "impacted_requirement_ids": ["NK-01-R01","NK-01-R02","NK-01-R03","NK-01-R04","NK-01-R05","NK-01-R06","NK-02-R01","NK-02-R02","NK-02-R03","NK-02-R04","NK-02-R05","NK-02-R06","NK-03-R01","NK-03-R02","NK-03-R03","NK-03-R04","NK-03-R05","NK-03-R06","NK-04-R01","NK-04-R02","NK-04-R03","NK-04-R04","NK-04-R05","NK-04-R06","NK-05-R01","NK-05-R02","NK-05-R03","NK-05-R04","NK-05-R05","NK-05-R06","NK-07-R01","NK-07-R02","NK-07-R03","NK-07-R04","NK-07-R05","NK-07-R06","NK-08-R01","NK-08-R02","NK-08-R03","NK-08-R04","NK-08-R05","NK-08-R06","NK-09-R01","NK-09-R02","NK-09-R03","NK-09-R04","NK-09-R05","NK-09-R06","NK-10-R01","NK-10-R02","NK-10-R03","NK-10-R04","NK-10-R05","NK-10-R06","NK-11-R01","NK-11-R02","NK-11-R03","NK-11-R04","NK-11-R05","NK-11-R06","NK-12-R01","NK-12-R02","NK-12-R03","NK-12-R04","NK-12-R05","NK-12-R06","NK-13-R01","NK-13-R02","NK-13-R03","NK-13-R04","NK-13-R05","NK-13-R06"],
      "source_boundary_note": "Registration records source identity only; it does not establish scientific validity, regulatory status, clinical benefit, deployment, commercial status, or conformance."
    },
    {
      "proposal_id": "LEGACY-SRC-PROP-003",
      "action": "REGISTER_NEW_SOURCE",
      "review_state": "PROPOSED_NONCANONICAL",
      "identity_rule": "EXACT_NORMALIZED_URL_AND_CHECKSUM",
      "identity_rationale": "Evidence records are grouped only when an identical normalized public URL and/or normalized checksum establishes exact artifact identity.",
      "normalized_public_url": "https://github.com/facebookresearch/brain2qwerty/tree/3bf5a4099ca0d23bbe994b2287905760236e56e0",
      "checksum": "634f47cd01c04ec21bf4bff3b004eb99758936fa314907519434fdfb029f98dd",
      "existing_source_id": null,"requested_source_id": null,
      "linked_evidence": [{"system":"Brain2Qwerty","assessment_version":"v4.1.3","evidence_id":"EV-04","title":"brain2qwerty repository snapshot metadata","source_label":"Meta FAIR GitHub repository","evidence_type":"CODE REPOSITORY SNAPSHOT","evidence_class":null,"publication_state":"Public repository snapshot at controlled commit"}],
      "impacted_requirement_count": 73,
      "impacted_requirement_ids": ["NK-01-R01","NK-01-R02","NK-01-R03","NK-01-R04","NK-01-R05","NK-01-R06","NK-02-R01","NK-02-R02","NK-02-R03","NK-02-R04","NK-02-R05","NK-02-R06","NK-03-R01","NK-03-R02","NK-03-R03","NK-03-R04","NK-03-R05","NK-03-R06","NK-04-R01","NK-04-R02","NK-04-R03","NK-04-R04","NK-04-R05","NK-04-R06","NK-05-R01","NK-05-R02","NK-05-R03","NK-05-R04","NK-05-R05","NK-05-R06","NK-06-R01","NK-07-R01","NK-07-R02","NK-07-R03","NK-07-R04","NK-07-R05","NK-07-R06","NK-08-R01","NK-08-R02","NK-08-R03","NK-08-R04","NK-08-R05","NK-08-R06","NK-09-R01","NK-09-R02","NK-09-R03","NK-09-R04","NK-09-R05","NK-09-R06","NK-10-R01","NK-10-R02","NK-10-R03","NK-10-R04","NK-10-R05","NK-10-R06","NK-11-R01","NK-11-R02","NK-11-R03","NK-11-R04","NK-11-R05","NK-11-R06","NK-12-R01","NK-12-R02","NK-12-R03","NK-12-R04","NK-12-R05","NK-12-R06","NK-13-R01","NK-13-R02","NK-13-R03","NK-13-R04","NK-13-R05","NK-13-R06"],
      "source_boundary_note":"Registration records source identity only; it does not establish scientific validity, regulatory status, clinical benefit, deployment, commercial status, or conformance."
    },
    {
      "proposal_id":"LEGACY-SRC-PROP-004","action":"REGISTER_NEW_SOURCE","review_state":"PROPOSED_NONCANONICAL","identity_rule":"EXACT_NORMALIZED_URL_AND_CHECKSUM","identity_rationale":"Evidence records are grouped only when an identical normalized public URL and/or normalized checksum establishes exact artifact identity.","normalized_public_url":"https://github.com/facebookresearch/brain2qwerty/blob/3bf5a4099ca0d23bbe994b2287905760236e56e0/README.md","checksum":"0ec11d72fd55988796214aaa7d5dc80dbe11c83399a4feb37323b1344caad954","existing_source_id":null,"requested_source_id":null,"linked_evidence":[{"system":"Brain2Qwerty","assessment_version":"v4.1.3","evidence_id":"EV-05","title":"brain2qwerty v2 README at controlled commit","source_label":"Meta FAIR GitHub repository","evidence_type":"METHOD OR TECHNICAL DOCUMENT","evidence_class":null,"publication_state":"Public repository file at controlled commit"}],"impacted_requirement_count":58,"impacted_requirement_ids":["NK-01-R01","NK-01-R02","NK-01-R03","NK-01-R04","NK-01-R05","NK-01-R06","NK-02-R01","NK-02-R02","NK-02-R03","NK-02-R04","NK-02-R05","NK-02-R06","NK-03-R01","NK-03-R02","NK-03-R03","NK-03-R04","NK-03-R05","NK-03-R06","NK-04-R01","NK-04-R02","NK-04-R03","NK-04-R04","NK-04-R05","NK-04-R06","NK-05-R01","NK-05-R02","NK-05-R03","NK-05-R04","NK-05-R05","NK-05-R06","NK-07-R01","NK-07-R02","NK-07-R03","NK-07-R04","NK-07-R05","NK-07-R06","NK-08-R01","NK-08-R02","NK-08-R03","NK-08-R04","NK-08-R05","NK-08-R06","NK-09-R01","NK-09-R02","NK-09-R03","NK-09-R04","NK-09-R05","NK-09-R06","NK-12-R01","NK-12-R02","NK-12-R03","NK-12-R04","NK-12-R05","NK-12-R06","NK-13-R01","NK-13-R02","NK-13-R03","NK-13-R04"],"source_boundary_note":"Registration records source identity only; it does not establish scientific validity, regulatory status, clinical benefit, deployment, commercial status, or conformance."},
    {